{
  "name": "Anneau du Parangon de l'Ordre des Lame-éther",
  "status": "draft",
  "section": "bijoux",
  "position": 13,
  "kind": "Bijou",
  "rarity": "rare",
  "art": "anneau-du-parangon-de-l-ordre-des-lame-ether-1_1-og.png",
  "set": "LAMET",
  "properties": [
    {
      "name": "Geste assuré.",
      "text": "Vos {{jet|Jets}} de {{constitution}} + {{volonte}} pour maintenir votre {{concentration}} gagnent 1 {{avantage}}."
    }
  ],
  "description": "Un large anneau de métal blanc bordé d'or, couronné d'un cristal bleu taillé en pointe."
}
