{
  "name": "Philtre de vigueur",
  "status": "draft",
  "section": "consommables",
  "position": 3,
  "kind": "Consommable",
  "rarity": "common",
  "price": 2200,
  "headlines": [
    {
      "label": "Énergie",
      "value": "1d4"
    }
  ],
  "stats": [
    {
      "label": "Activation",
      "value": "1 Action bonus"
    },
    {
      "label": "Portée",
      "value": "Soi"
    },
    {
      "label": "Durée",
      "value": "Instantanée"
    }
  ],
  "craft": {
    "discipline": "science",
    "cost": 22,
    "materials": [
      "Plante"
    ],
    "sequence": [
      "Intelligence 12"
    ]
  },
  "text": "Vous pouvez effectuer une {{action-bonus}} pour boire ce philtre et récupérer ***1d4*** points d'{{energie}}. Votre {{energie}} ne dépasse jamais son maximum.",
  "description": "Amer, poivré, servi tiède. Il rend le souffle sans rendre le repos."
}
