{
  "name": "Broche du Parangon de l'Ordre des Némérites",
  "status": "draft",
  "section": "bijoux",
  "position": 9,
  "kind": "Bijou",
  "rarity": "rare",
  "set": "NEMER",
  "properties": [
    {
      "name": "Catalyseur.",
      "text": "Tant que cette pièce est équipée, vous pouvez utiliser vos {{sort|Sorts}}, passifs comme actifs."
    }
  ],
  "description": "Une broche à pointes blanches et dorées autour d'une pierre noire taillée en losange."
}
