{
  "name": "Cotte de mailles",
  "status": "draft",
  "section": "torse",
  "position": 2,
  "kind": "Armure",
  "rarity": "common",
  "price": 1200,
  "prerequisite": "Force +3",
  "headlines": [
    {
      "label": "CA",
      "value": "16"
    }
  ],
  "properties": [
    {
      "name": "Encombrante.",
      "text": "Vous gagnez 1 {{desavantage}} à tous vos {{jet|Jets}} de {{dexterite}}."
    }
  ],
  "craft": {
    "discipline": "artisanat",
    "cost": 12,
    "materials": [
      "Métal"
    ],
    "sequence": [
      "Force 15",
      "Dextérité 10"
    ]
  },
  "description": "Anneaux rivetés du col aux cuisses. Elle arrête presque tout, et se fait sentir dès la première heure de marche."
}
