{
  "name": "Hydro-catalyseur",
  "status": "draft",
  "section": "bijoux",
  "position": 1,
  "kind": "Bijou",
  "rarity": "common",
  "price": 1600,
  "headlines": [
    {
      "label": "Domaine",
      "value": "Eau"
    }
  ],
  "properties": [
    {
      "name": "Catalyseur.",
      "text": "Tant que cette pièce est équipée, vous pouvez utiliser vos {{sort|Sorts}}, passifs comme actifs."
    },
    {
      "name": "Matériel.",
      "text": "Ce catalyseur peut être consommé comme matériau (Type : Catalyseur ; Valeur : 4)."
    }
  ],
  "craft": {
    "discipline": "arcanes",
    "cost": 16,
    "materials": [
      "Gemme"
    ],
    "sequence": [
      "Dextérité 10",
      "Intelligence 10"
    ]
  },
  "grants": [
    "LAMEAU-001"
  ],
  "description": "Cristal bleu traversé de courants lents. Il reste froid, même en plein soleil."
}
