{
  "name": "Robe du Parangon de l'Ordre des Sibylles",
  "status": "draft",
  "section": "torse",
  "position": 7,
  "kind": "Armure",
  "rarity": "rare",
  "set": "SIBYL",
  "headlines": [
    {
      "label": "CA",
      "value": "14 + Intelligence OU Esprit OU Charisme"
    }
  ],
  "description": "Une robe blanche à longs pans bordés d'or, ouverte sur une étoffe bleu nuit piquée d'étoiles. Trois attaches rondes ferment le devant."
}
