{
  "name": "Pistolet",
  "status": "playtest",
  "section": "armes-distance",
  "position": 0,
  "kind": "Arme à distance",
  "rarity": "common",
  "art": "revolver-1_1-og.png",
  "price": 500,
  "headlines": [
    {
      "label": "Dégâts",
      "value": "1d6 + Dextérité"
    }
  ],
  "stats": [
    {
      "label": "Jet",
      "value": "Dextérité + Visée"
    },
    {
      "label": "Portée",
      "value": "9m"
    },
    {
      "label": "Type de dégâts",
      "value": "Perforants"
    },
    {
      "label": "Mains",
      "value": "1 main"
    }
  ],
  "properties": [
    {
      "name": "Barillet (6).",
      "text": "Cette arme peut effectuer jusqu'à 6 {{attaque|attaques}} avant de devoir être rechargée. Une fois son Barillet vide, vous devez utiliser une {{action}} pour le recharger complètement avant de pouvoir effectuer une nouvelle {{attaque|attaque}} avec cette arme."
    },
    {
      "name": "Munitions catalysées.",
      "text": "Cette arme produit ses propres projectiles ; elle ne consomme aucune munition."
    }
  ],
  "craft": {
    "discipline": "artisanat",
    "cost": 5,
    "materials": [
      "Bois",
      "Métal"
    ],
    "sequence": [
      "Dextérité 14",
      "Intelligence 15"
    ]
  },
  "description": "Six chambres, une détente. Le rechargement coûte une Action entière."
}
