{
  "name": "Myxo-catalyseur",
  "status": "draft",
  "section": "bijoux",
  "position": 5,
  "kind": "Bijou",
  "rarity": "common",
  "art": "myxo-catalyseur-1_1-og.png",
  "price": 1600,
  "headlines": [
    {
      "label": "Domaine",
      "value": "Poisse"
    }
  ],
  "properties": [
    {
      "name": "Catalyseur.",
      "text": "Tant que cette pièce est équipée, vous pouvez utiliser vos {{sort|Sorts}}, passifs comme actifs."
    },
    {
      "name": "Matériel.",
      "text": "Ce catalyseur peut être consommé comme matériau (Type : Catalyseur ; Valeur : 4)."
    }
  ],
  "craft": {
    "discipline": "arcanes",
    "cost": 16,
    "materials": [
      "Gemme"
    ],
    "sequence": [
      "Dextérité 12",
      "Intelligence 15"
    ]
  },
  "grants": [
    "AMOPOI-001"
  ],
  "description": "Gemme sombre noyée de sève verte. Ce qu'elle touche colle, puis se creuse."
}
