{
  "name": "Huile ardente",
  "status": "draft",
  "section": "consommables",
  "position": 4,
  "kind": "Consommable",
  "rarity": "uncommon",
  "price": 11200,
  "headlines": [
    {
      "label": "Dégâts",
      "value": "2d6"
    }
  ],
  "stats": [
    {
      "label": "Activation",
      "value": "1 Action"
    },
    {
      "label": "Portée",
      "value": "9m"
    },
    {
      "label": "Type de dégâts",
      "value": "Feu"
    }
  ],
  "craft": {
    "discipline": "science",
    "cost": 28,
    "materials": [
      "Plante"
    ],
    "sequence": [
      "Intelligence 10"
    ]
  },
  "text": "Vous pouvez effectuer une {{action}} pour lancer cette fiole sur une créature que vous voyez à portée. Effectuez un {{jet}} de {{dexterite}} + {{visee}} contre sa {{ca}}. En cas de réussite, elle subit ***2d6*** dégâts de Feu. Si vous avez débloqué l'Arbre {{feu}}, vous gagnez aussi 2 {{combustion}}.",
  "description": "Huile noire qui s'accroche à ce qu'elle touche. Elle brûle lentement, et sa chaleur revient dans la main qui l'a lancée."
}
