{
  "name": "Torque du Parangon de l'Ordre des Némérites",
  "status": "draft",
  "section": "colliers",
  "position": 2,
  "kind": "Collier",
  "rarity": "rare",
  "art": "torque-du-parangon-de-l-ordre-des-nemerites-1_1-og.png",
  "set": "NEMER",
  "headlines": [
    {
      "label": "Vitesse",
      "value": "+1,5 m"
    }
  ],
  "description": "Un torque ouvert de plaques blanches et dorées, jointes par un losange à la base du cou."
}
