{
  "name": "Bandes de poing",
  "status": "draft",
  "section": "armes-poing",
  "position": 0,
  "kind": "Arme de poing",
  "rarity": "common",
  "price": 300,
  "headlines": [
    {
      "label": "Dégâts",
      "value": "1d4 + Force"
    }
  ],
  "stats": [
    {
      "label": "Jet",
      "value": "Force + Mêlée"
    },
    {
      "label": "Portée",
      "value": "Contact (1,5m)"
    },
    {
      "label": "Type de dégâts",
      "value": "Contondants"
    },
    {
      "label": "Mains",
      "value": "1 main"
    }
  ],
  "properties": [
    {
      "name": "Finesse.",
      "text": "Cette arme peut utiliser {{dexterite}} + {{finesse}} à la place de {{force}} + {{melee}}. Lorsque vous le faites, utilisez également votre {{dexterite}} à la place de votre {{force}} pour ses dégâts."
    },
    {
      "name": "Légère.",
      "text": "Lorsque vous tenez une arme Légère dans chacune de vos mains et que vous effectuez une {{attaque|attaque}} avec l'une d'elles, vous pouvez utiliser votre {{action-bonus}} pour effectuer une {{attaque|attaque}} avec l'autre. Cette {{attaque|attaque}} n'ajoute pas sa {{caracteristique}} à ses dégâts."
    }
  ],
  "craft": {
    "discipline": "artisanat",
    "cost": 3,
    "materials": [
      "Cuir"
    ],
    "sequence": [
      "Dextérité 10"
    ]
  },
  "description": "Lanières de cuir serrées autour du poing et du poignet. Elles ne font pas plus mal, elles laissent frapper plus longtemps."
}
